http://techweeklahackathon.challengepost.com/?ref_content=default&ref_feature=challenge&ref_medium=discover,Techweek Hackathon Los Angeles,challengepost-s3-challengepost.netdna-ssl.com/photos/production/challenge_thumbnails/000/174/196/datas/medium.png,"Santa Monica, CA, US",Santa Monica,CA,"Nov 22, 2014",46,US,Join us at General Assembly for the Techweek Los Angeles Hackathon.
http://bsrhack.challengepost.com/?ref_content=default&ref_feature=challenge&ref_medium=discover,BSR Sustainability Hackathon,challengepost-s3-challengepost.netdna-ssl.com/photos/production/challenge_thumbnails/000/179/300/datas/medium.jpeg,"Brooklyn, NY, US",Brooklyn,NY,"Nov 1 – 2, 2014",46,US,"Sustainability Hackathon in Brooklyn - create hacks that have a positive impact on the world and win up to $4,000 and a chance to present to our conference."
http://sinch.challengepost.com/?ref_content=default&ref_feature=challenge&ref_medium=discover,Sinch Communications Challenge,challengepost-s3-challengepost.netdna-ssl.com/photos/production/challenge_thumbnails/000/176/756/datas/medium.jpg,Online,,,,0,,Leverage the Sinch SDK in your app to revolutionize communications. What will you build with real-time voice calling and instant messaging?
http://hackmit2014.challengepost.com/?ref_content=default&ref_feature=challenge&ref_medium=discover,HackMIT'14,challengepost-s3-challengepost.netdna-ssl.com/photos/production/challenge_thumbnails/000/167/289/datas/medium.jpg,"Cambridge, Massachusetts, United States",Cambridge,Massachusetts,"Oct 4 – 8, 2014",45,United States,"Get ready for a hackathon like none other. Oct 4-5, 2014, MIT Campus. Open to all undergraduates from all universities."
http://inmobihackday2014.challengepost.com/?ref_content=default&ref_feature=challenge&ref_medium=discover,InMobi Hack Day 2014,challengepost-s3-challengepost.netdna-ssl.com/photos/production/challenge_thumbnails/000/167/178/datas/medium.jpg,"Bengaluru, KA, IN",Bengaluru,KA,"Oct 11 – 12, 2014",45,IN,InMobi's Flagship Hackathon
http://calhacks.challengepost.com/?ref_content=default&ref_feature=challenge&ref_medium=discover,Cal Hacks,challengepost-s3-challengepost.netdna-ssl.com/photos/production/challenge_thumbnails/000/151/255/datas/medium.png,"Berkeley, CA, US",Berkeley,CA,"Oct 4 – 5, 2014",45,US,Cal Hacks is the first major collegiate hackathon in the Bay Area.
http://winfoiwh2014.challengepost.com/?ref_content=default&ref_feature=challenge&ref_medium=discover,WINFO presents the 3rd Annual International Women's Hackathon,challengepost-s3-challengepost.netdna-ssl.com/photos/production/challenge_thumbnails/000/165/060/datas/medium.jpg,"Seattle, WA, US",Seattle,WA,"Oct 11, 2014",45,US,Calling all women who want to save the world! All experience levels welcome.
http://hackzurich.challengepost.com/?ref_content=default&ref_feature=challenge&ref_medium=discover,HackZurich,challengepost-s3-challengepost.netdna-ssl.com/photos/production/challenge_thumbnails/000/163/090/datas/medium.png,"Zurich, ZH, CH",Zurich,ZH,"Oct 10 – 12, 2014",45,CH,HackZurich is the largest hackathon Switzerland has ever seen.
http://delhack.challengepost.com/?ref_content=default&ref_feature=challenge&ref_medium=discover,DelHack,challengepost-s3-challengepost.netdna-ssl.com/photos/production/challenge_thumbnails/000/164/186/datas/medium.png,"Newark, DE, US",Newark,DE,"Oct 4 – 5, 2014",45,US,Delaware's Premier Student Run Hackathon.
http://pakathonglobal2014.challengepost.com/?ref_content=default&ref_feature=challenge&ref_medium=discover,Pakathon Global,challengepost-s3-challengepost.netdna-ssl.com/photos/production/challenge_thumbnails/000/162/095/datas/medium.png,,,,"Sep 27 – Oct 7, 2014",44,,Startup weekend for Pakistan in 16 cities
http://micronwhacks.challengepost.com/?ref_content=default&ref_feature=challenge&ref_medium=discover,micro.nwhacks,challengepost2.assetspost.com/assets/defaults/thumbnail-placeholder-42bcab8d8178b413922ae2877d8b0868.gif,"Vancouver, BC, CA",Vancouver,BC,"Sep 27, 2014",44,CA,The small but EPIC hackathon. Come out and build something awesome with friends and make new connections friends and learn something new! Beginners to pros are welcome at nwHacks Micro.
http://css-hackathon.challengepost.com/?ref_content=default&ref_feature=challenge&ref_medium=discover,CSS Hackathon,challengepost-s3-challengepost.netdna-ssl.com/photos/production/challenge_thumbnails/000/162/631/datas/medium.jpg,"Kingston, Ontario, Canada",Kingston,Ontario,"Sep 26 – 28, 2014",44,Canada,A weekend of hacking at Queen's.
http://ese111f14.challengepost.com/?ref_content=default&ref_feature=challenge&ref_medium=discover,"ESE111, Atoms, Bits, Circuits, and Systems (Fall 2014)",challengepost2.assetspost.com/assets/defaults/thumbnail-placeholder-42bcab8d8178b413922ae2877d8b0868.gif,"Philadelphia, PA, US",Philadelphia,PA,"Nov 12 – Dec 14, 2014",46,US,ESE111
http://hackrpi.challengepost.com/?ref_content=default&ref_feature=challenge&ref_medium=discover,Hack(RPI);,challengepost-s3-challengepost.netdna-ssl.com/photos/production/challenge_thumbnails/000/182/552/datas/medium.png,"Troy, NY, US",Troy,NY,"Nov 15 – 16, 2014",46,US,Come hack with us
http://designhack2014.challengepost.com/?ref_content=default&ref_feature=challenge&ref_medium=discover,Design & Hack,challengepost-s3-challengepost.netdna-ssl.com/photos/production/challenge_thumbnails/000/184/310/datas/medium.png,"New York, New York, United States",New York,New York,"Nov 14 – 16, 2014",46,United States,"Designers and Developers learn from each other, collaborate, and make awesome things!"
http://hpuiwh2014.challengepost.com/?ref_content=default&ref_feature=challenge&ref_medium=discover,2014 International Women's Hackathon Hawaii | Nov 23rd,challengepost-s3-challengepost.netdna-ssl.com/photos/production/challenge_thumbnails/000/184/727/datas/medium.png,"Honolulu, HI, US",Honolulu,HI,"Nov 23 – 24, 2014",46,US,Join us on Nov 23rd for the International Women’s Hackathon event in Hawaii
http://wwinvents.challengepost.com/?ref_content=default&ref_feature=challenge&ref_medium=discover,Wearable World Invents:  The Connected Airport,challengepost-s3-challengepost.netdna-ssl.com/photos/production/challenge_thumbnails/000/184/608/datas/medium.png,Online,,,,0,,An Innovative Virtual Developer Challenge Featuring San Francisco International Airport (SFO)
http://winfoiwh2014ucirvine.challengepost.com/?ref_content=default&ref_feature=challenge&ref_medium=discover,International Women's Hackathon UC Irvine,challengepost-s3-challengepost.netdna-ssl.com/photos/production/challenge_thumbnails/000/169/747/datas/medium.jpg,"Irvine, CA, US",Irvine,CA,"Nov 15, 2014",46,US,Join us on November 15th for the International Women’s Hackathon event in UC Irvine
http://iwh2014trinity.challengepost.com/?ref_content=default&ref_feature=challenge&ref_medium=discover,Trinity University Sit With Me Hackathon,challengepost2.assetspost.com/assets/defaults/thumbnail-placeholder-42bcab8d8178b413922ae2877d8b0868.gif,"San Antonio, TX, US",San Antonio,TX,"Nov 15, 2014",46,US,Code With WIC
http://datageneratorhacakthon.challengepost.com/?ref_content=default&ref_feature=challenge&ref_medium=discover,DataGenerator Hacakthon,challengepost-s3-challengepost.netdna-ssl.com/photos/production/challenge_thumbnails/000/182/646/datas/medium.png,,,,"Nov 15, 2014",46,,Join the DataGenerator team at our Hackathon to learn about the latest features and apply the tool to new and interesting problems.
http://hacck2014.challengepost.com/?ref_content=default&ref_feature=challenge&ref_medium=discover,HACCK at UVA 2014,challengepost-s3-challengepost.netdna-ssl.com/photos/production/challenge_thumbnails/000/184/453/datas/medium.png,"Charlottesville, Virginia, United States",Charlottesville,Virginia,"Nov 15 – 16, 2014",46,United States,HACCK is a 24 hour hackathon on November 15 & 16 at the University of Virginia in honor of Connor Cormier.
http://gopher-gala.challengepost.com/?ref_content=default&ref_feature=challenge&ref_medium=discover,Gopher Gala,challengepost-s3-challengepost.netdna-ssl.com/photos/production/challenge_thumbnails/000/203/558/datas/medium.jpg,"Suwanee, GA, US",Suwanee,GA,"Jan 23 – 25, 2015",48,US,The world's first Golang distributed hackathon.
http://kandy.challengepost.com/?ref_content=default&ref_feature=challenge&ref_medium=discover,The Kandy Throw Down,challengepost-s3-challengepost.netdna-ssl.com/photos/production/challenge_thumbnails/000/197/109/datas/medium.jpg,Online,,,,0,,Put your app in beast mode. Give it Kandy – reliable real-time communications SDKs for every scenario and every developer.
http://hacknightii.challengepost.com/?ref_content=default&ref_feature=challenge&ref_medium=discover,Hack Night II hosted by TESC + WIC,challengepost-s3-challengepost.netdna-ssl.com/photos/production/challenge_thumbnails/000/198/922/datas/medium.jpg,,,,"Jan 17, 2015",48,,Test out your hacking skills or start that long-term project you've always wanted to at Hack Night hosted by TESC and Women in Computing!
http://hackawaylittlebits.challengepost.com/?ref_content=default&ref_feature=challenge&ref_medium=discover,Hackaway littleBits All-Ages Hackathon,challengepost1.assetspost.com/assets/defaults/thumbnail-placeholder-42bcab8d8178b413922ae2877d8b0868.gif,"Redwood City, CA, US",Redwood City,CA,"Jan 17, 2015",48,US,"Making life easier, better, or more entertaining with the use of electronics"
http://hackutd.challengepost.com/?ref_content=default&ref_feature=challenge&ref_medium=discover,Hack_UTD,challengepost-s3-challengepost.netdna-ssl.com/photos/production/challenge_thumbnails/000/197/502/datas/medium.png,"Richardson, TX, US",Richardson,TX,"Jan 17 – 18, 2015",48,US,"UTD's First Major Hackathon. 24 hours of hacking, learning, and mentorship."
http://epsonmoverio2.challengepost.com/?ref_content=default&ref_feature=challenge&ref_medium=discover,Round 2: Epson Moverio Develop the Future App Challenge,challengepost-s3-challengepost.netdna-ssl.com/photos/production/challenge_thumbnails/000/194/222/datas/medium.jpg,Online,,,,0,,Create the best Moverio Smart Glasses App. Develop the Future.
http://hackcesstojusticenola.challengepost.com/?ref_content=default&ref_feature=challenge&ref_medium=discover,Hackcess to Justice Louisiana,challengepost1.assetspost.com/assets/defaults/thumbnail-placeholder-42bcab8d8178b413922ae2877d8b0868.gif,"New Orleans, LA, US",New Orleans,LA,"Mar 21 – 22, 2015",50,US,Join the ABA Journal and the Louisiana State Bar Association as we present Louisiana's first access to justice hackathon
http://infusionsoft.challengepost.com/?ref_content=default&ref_feature=challenge&ref_medium=discover,Infusionsoft® Battle of the Apps 2015,challengepost-s3-challengepost.netdna-ssl.com/photos/production/challenge_thumbnails/000/197/184/datas/medium.png,Online,,,,0,,Help small businesses succeed with Infusionsoft!
http://webgl3dmodelviewer.challengepost.com/?ref_content=default&ref_feature=challenge&ref_medium=discover,WebGL 3D model viewer for Wordpress,challengepost1.assetspost.com/assets/defaults/thumbnail-placeholder-42bcab8d8178b413922ae2877d8b0868.gif,"New York, NY, US",New York,NY,"Jan 30 – Feb 1, 2015",48,US,Using web3d to assist the building industry at the http://aechackathon.com/aec-hackathon-new-york/
http://feasthackathon.challengepost.com/?ref_content=default&ref_feature=challenge&ref_medium=discover,Feast Hackathon,challengepost-s3-challengepost.netdna-ssl.com/photos/production/challenge_thumbnails/000/074/051/datas/medium.jpeg,"New York, New York, United States",New York,New York,"Oct 12 – 13, 2013",33,United States,The Feast curates carefully crafted Challenges that are ripe for innovation
http://hackmit.challengepost.com/?ref_content=default&ref_feature=challenge&ref_medium=discover,HackMIT,challengepost-s3-challengepost.netdna-ssl.com/photos/production/challenge_thumbnails/000/074/055/datas/medium.png,"Cambridge, Massachusetts, United States",Cambridge,Massachusetts,"Oct 5 – 6, 2013",33,United States,"1000+ people, $10k+ prizes, 30 hours. October 5-6, 2013 at MIT. Open to all students, all schools."
http://kenthackenough.challengepost.com/?ref_content=default&ref_feature=challenge&ref_medium=discover,Kent Hack Enough,challengepost-s3-challengepost.netdna-ssl.com/photos/production/challenge_thumbnails/000/074/063/datas/medium.png,"Kent, Ohio, United States",Kent,Ohio,"Oct 18 – 20, 2013",33,United States,"Design, create and build. You can't afford to miss out on Ohio's largest hackathon!"
http://energyappsontario.challengepost.com/?ref_content=default&ref_feature=challenge&ref_medium=discover,Energy Apps for Ontario Challenge,challengepost-s3-challengepost.netdna-ssl.com/photos/production/challenge_thumbnails/000/074/027/datas/medium.gif,Online,,,,0,,Create an app to help Ontarians unlock the potential of Green Button electricity data.
http://sloiac.challengepost.com/?ref_content=default&ref_feature=challenge&ref_medium=discover,Cal Poly SLO iOS App Challenge,challengepost-s3-challengepost.netdna-ssl.com/photos/production/challenge_thumbnails/000/074/048/datas/medium.png,"San Luis Obispo, California, United States",San Luis Obispo,California,"Oct 18 – 21, 2013",33,United States,WISH and ACM at Cal Poly are presenting the iOS App Challenge. You'll have a weekend to make an iOS app and Apple will have engineers on-site to answer your technical questions.
http://bigbyte.challengepost.com/?ref_content=default&ref_feature=challenge&ref_medium=discover,Duke Big Byte Challenge,challengepost-s3-challengepost.netdna-ssl.com/photos/production/challenge_thumbnails/000/074/047/datas/medium.png,"Durham, North Carolina, United States",Durham,North Carolina,"Sep 27 – 30, 2013",32,United States,"The Big Byte Challenge is an event produced by students and for students produced by Duke University, Apple Inc., and the AT&T Developer Program for Duke undergraduate and graduate students only."
http://artsdata.challengepost.com/?ref_content=default&ref_feature=challenge&ref_medium=discover,Presenting Arts Data Artfully,challengepost-s3-challengepost.netdna-ssl.com/photos/production/challenge_thumbnails/000/074/035/datas/medium.png,Online,,,,0,,The NEA wants your help developing interactive data visualizations for our flagship arts participation data. Your work could be featured at arts.gov and promoted to arts organizations everywhere.
http://thebigsix.challengepost.com/?ref_content=default&ref_feature=challenge&ref_medium=discover,The Big Six (Casino Hackathon),challengepost-s3-challengepost.netdna-ssl.com/photos/production/challenge_thumbnails/000/074/044/datas/medium.jpg,"London, United Kingdom",London,United Kingdom,"Sep 28, 2013",32,,A Casino Games Hackathon at a London Casino!
http://iothacknyc.challengepost.com/?ref_content=default&ref_feature=challenge&ref_medium=discover,Internet of Things Hackathon - NYC,challengepost-s3-challengepost.netdna-ssl.com/photos/production/challenge_thumbnails/000/074/030/datas/medium.png,"New York, New York, United States",New York,New York,"Sep 27 – 28, 2013",32,United States,The “Internet of Things” Hackathon & Accelerator Series is a sequence of hackathons that focus on building apps that are compatible with multiple devices.
http://solarhackathon.challengepost.com/?ref_content=default&ref_feature=challenge&ref_medium=discover,The SfunCube Solar Hackathon 2013,challengepost-s3-challengepost.netdna-ssl.com/photos/production/challenge_thumbnails/000/074/020/datas/medium.jpg,"Oakland, California, United States",Oakland,California,"Sep 13 – 15, 2013",32,United States,See link to 2015 edition below
http://hackregina.challengepost.com/?ref_content=default&ref_feature=challenge&ref_medium=discover,HackREGINA,challengepost-s3-challengepost.netdna-ssl.com/photos/production/challenge_thumbnails/000/074/016/datas/medium.png,"Regina, Saskatchewan, Canada",Regina,Saskatchewan,"Sep 28, 2013",32,Canada,"Duke it out with 50 other developers, designers, and analysts to make an application using one or more sponsored APIs. Teams present to a panel of judges for fame and prizes!"
http://cleanandgreenhackathon.challengepost.com/?ref_content=default&ref_feature=challenge&ref_medium=discover,Clean and Green Hackathon,challengepost-s3-challengepost.netdna-ssl.com/photos/production/challenge_thumbnails/000/074/015/datas/medium.png,"San Francisco, California, United States",San Francisco,California,"Aug 9 – 10, 2013",31,United States,The world’s best developers and designers will use their talent and creativity to create innovative approaches to combat climate change.
http://dashing.challengepost.com/?ref_content=default&ref_feature=challenge&ref_medium=discover,The Dashing Widget Challenge,challengepost-s3-challengepost.netdna-ssl.com/photos/production/challenge_thumbnails/000/074/013/datas/medium.gif,Online,,,,0,,"Create widgets for Dashing, the exceptionally handsome, open source dashboard framework."
http://nycfiberaccess.challengepost.com/?ref_content=default&ref_feature=challenge&ref_medium=discover,ConnectNYC Fiber Access Program,challengepost-s3-challengepost.netdna-ssl.com/photos/production/challenge_thumbnails/000/073/996/datas/medium.jpg,Online,,,,0,,"Need faster, more reliable internet? NYC is helping connect the City’s growing companies to high-speed internet by providing free fiber optic construction to qualifying businesses.*"
http://akoma-ntoso-markup.challengepost.com/?ref_content=default&ref_feature=challenge&ref_medium=discover,Markup of US Legislation in Akoma Ntoso,challengepost-s3-challengepost.netdna-ssl.com/photos/production/challenge_thumbnails/000/073/970/datas/medium.JPG,Online,,,,0,,A legislative data challenge to advance the development of international data exchange standards.
http://stormfinaglehack.challengepost.com/?ref_content=default&ref_feature=challenge&ref_medium=discover,Hopper Storm & Finagle Hackathon,challengepost-s3-challengepost.netdna-ssl.com/photos/production/challenge_thumbnails/000/074/010/datas/medium.png,"Cambridge, Massachusetts, United States",Cambridge,Massachusetts,"Jul 20, 2013",30,United States,"Join us for a full day of Storm hacking on a 100-node cluster! The crowd-voted best team wins a 1-year subscription for SoftLayer (a $12,000 value)!"
http://gamifyasthma.challengepost.com/?ref_content=default&ref_feature=challenge&ref_medium=discover,Gamify Asthma,challengepost-s3-challengepost.netdna-ssl.com/photos/production/challenge_thumbnails/000/074/009/datas/medium.jpeg,"Washington, District of Columbia, United States",Washington,District of Columbia,"Jul 20, 2013",30,United States,Help kids with asthma and win cash prizes!
http://fairlabor.challengepost.com/?ref_content=default&ref_feature=challenge&ref_medium=discover,DOL Fair Labor Data Challenge,challengepost3.assetspost.com/assets/defaults/thumbnail-placeholder-42bcab8d8178b413922ae2877d8b0868.gif,Online,,,,0,,Create an innovative tool that lets an informed consumer find out if a business is obeying the law when it comes to paying workers properly.
http://insanityhackathon.challengepost.com/?ref_content=default&ref_feature=challenge&ref_medium=discover,Insanity Hackathon,challengepost-s3-challengepost.netdna-ssl.com/photos/production/challenge_thumbnails/000/074/069/datas/medium.jpg,"London, United Kingdom",London,United Kingdom,"Nov 23 – 24, 2013",34,,A hackathon taking it back to the old school & allowing you to hack awesome stuff of your own accord!
http://salesforce1million.challengepost.com/?ref_content=default&ref_feature=challenge&ref_medium=discover,Salesforce $1 Million Hackathon,challengepost-s3-challengepost.netdna-ssl.com/photos/production/challenge_thumbnails/000/074/066/datas/medium.png,"San Francisco, California, United States",San Francisco,California,"Nov 18 – 20, 2013",34,United States,Salesforce is challenging you to build next generation mobile apps in a $1 million hackathon.
http://opensvhackathon.challengepost.com/?ref_content=default&ref_feature=challenge&ref_medium=discover,OPEN SV Hackathon,challengepost-s3-challengepost.netdna-ssl.com/photos/production/challenge_thumbnails/000/074/094/datas/medium.png,"Mountain View, California, United States",Mountain View,California,"Nov 17 – 19, 2013",34,United States,OPEN Silicon Valley: 1-Day Hackathon
http://projectanarchyhackathon.challengepost.com/?ref_content=default&ref_feature=challenge&ref_medium=discover,Hacking Project Anarchy on Android,challengepost-s3-challengepost.netdna-ssl.com/photos/production/challenge_thumbnails/000/074/074/datas/medium.jpg,"Sacramento, California, United States",Sacramento,California,"Nov 9 – 14, 2013",34,United States,Give us your gaming best!
http://gameon.challengepost.com/?ref_content=default&ref_feature=challenge&ref_medium=discover,Game On! HIV/STD Prevention Mobile Application Video Game Challenge,challengepost-s3-challengepost.netdna-ssl.com/photos/production/challenge_thumbnails/000/074/082/datas/medium.png,Online,,,,0,,Create a mobile application (app) game to teach HIV and STD prevention strategies to teens and young adults
http://fabricjs.challengepost.com/?ref_content=default&ref_feature=challenge&ref_medium=discover,Explore interactivity with Fabric.js,challengepost-s3-challengepost.netdna-ssl.com/photos/production/challenge_thumbnails/000/074/038/datas/medium.png,Online,,,,0,,Help make the web beautiful by creating new demos with Fabric.js
http://dctechhack.challengepost.com/?ref_content=default&ref_feature=challenge&ref_medium=discover,DC Tech Hackathon Presented by D&B,challengepost-s3-challengepost.netdna-ssl.com/photos/production/challenge_thumbnails/000/074/072/datas/medium.JPG,"Chevy Chase, Maryland, United States",Chevy Chase,Maryland,"Nov 9 – 10, 2013",34,United States,A hackathon to help combat malfeasance and fight fraud waste and abuse in the public sector.
http://disrupteurope2013.challengepost.com/?ref_content=default&ref_feature=challenge&ref_medium=discover,Disrupt Europe 2013,challengepost-s3-challengepost.netdna-ssl.com/photos/production/challenge_thumbnails/000/074/049/datas/medium.png,"Berlin, Berlin, Germany",Berlin,Berlin,"Oct 26 – 27, 2013",33,Germany,Calling hackers and developers from all over the world — join teams to hack a product within 24 hours.
http://traffic.challengepost.com/?ref_content=default&ref_feature=challenge&ref_medium=discover,Traffic Tamer App Challenge,challengepost-s3-challengepost.netdna-ssl.com/photos/production/challenge_thumbnails/000/074/062/datas/medium.jpg,Online,,,,0,,Help tame London’s traffic by submitting apps that can help reduce congestion on the city’s streets.
http://hackforladec2013.challengepost.com/?ref_content=default&ref_feature=challenge&ref_medium=discover,Hack for LA December 2013,challengepost-s3-challengepost.netdna-ssl.com/photos/production/challenge_thumbnails/000/074/104/datas/medium.png,"Los Angeles, California, United States",Los Angeles,California,"Dec 7 – 8, 2013",35,United States,Hack for LA brings LA's tech community together to solve community challenges
http://chimehack.challengepost.com/?ref_content=default&ref_feature=challenge&ref_medium=discover,Chime Hack,challengepost-s3-challengepost.netdna-ssl.com/photos/production/challenge_thumbnails/000/074/103/datas/medium.JPG,"San Francisco, California, United States",San Francisco,California,"Dec 5 – 7, 2013",35,United States,Discovering tech-driven solutions to support girls and women around the world.
http://aspireapphackathon.challengepost.com/?ref_content=default&ref_feature=challenge&ref_medium=discover,AT&T Aspire Mobile App Hackathon,challengepost-s3-challengepost.netdna-ssl.com/photos/production/challenge_thumbnails/000/074/099/datas/medium.jpg,"Miami, Florida, United States",Miami,Florida,"Dec 13 – 14, 2013",35,United States,Have an app idea or need an app built for your business?
http://physicsjs.challengepost.com/?ref_content=default&ref_feature=challenge&ref_medium=discover,PhysicsJS,challengepost-s3-challengepost.netdna-ssl.com/photos/production/challenge_thumbnails/000/074/137/datas/medium.gif,Online,,,,0,,Apply the laws of motion to create realistic animation
http://masstransporthack.challengepost.com/?ref_content=default&ref_feature=challenge&ref_medium=discover,MassDOT Visualizing Transportation Hackathon,challengepost-s3-challengepost.netdna-ssl.com/photos/production/challenge_thumbnails/000/074/102/datas/medium.png,"Cambridge, Massachusetts, United States",Cambridge,Massachusetts,"Dec 14, 2013",35,United States,Informing the Future of Massachusetts Transportation through Data Analysis and Visualization.
http://letsbuildkaec.challengepost.com/?ref_content=default&ref_feature=challenge&ref_medium=discover,King Abdullah Economic City Apps Challenge,challengepost-s3-challengepost.netdna-ssl.com/photos/production/challenge_thumbnails/000/074/080/datas/medium.gif,Online,,,,0,,Be among the first wave of developers to help shape the digital layer of King Abdullah Economic City.
http://tizenapps.challengepost.com/?ref_content=default&ref_feature=challenge&ref_medium=discover,appbackr Tizen Challenge,challengepost-s3-challengepost.netdna-ssl.com/photos/production/challenge_thumbnails/000/074/087/datas/medium.gif,Online,,,,0,,HTML5 Developers - Win Cash Prizes When You Add Your Apps to the New Tizen Store
http://yammer-hacksgiving.challengepost.com/?ref_content=default&ref_feature=challenge&ref_medium=discover,Yammer Happy Hacksgiving 2013,challengepost-s3-challengepost.netdna-ssl.com/photos/production/challenge_thumbnails/000/074/093/datas/medium.png,"San Francisco, California, United States",San Francisco,California,"Nov 15 – 17, 2013",34,United States,Yammer's Happy Hacksgiving - a 24 -hour competition dedicated to building innovative enterprise applications on the Yammer Platform!
