http://hackecpat.challengepost.com/?ref_content=default&ref_feature=challenge&ref_medium=discover,HackECPAT End Trafficking Hackathon,challengepost-s3-challengepost.netdna-ssl.com/photos/production/challenge_thumbnails/000/264/767/datas/medium.jpg,,,,"Jul 18 – 19, 2015",54,,One Click to Prevention.
http://hackwiththebest.challengepost.com/?ref_content=default&ref_feature=challenge&ref_medium=discover,Hack With The Best,challengepost-s3-challengepost.netdna-ssl.com/photos/production/challenge_thumbnails/000/265/356/datas/medium.jpg,"Redwood City, CA, US",Redwood City,CA,"Jun 13 – 14, 2015",53,US,A weekend long Mercedes-Benz Hackathon that brings innovative and creative minds together to develop new concepts that will intersect IoT and Wearables with automotive technologies.
http://sense360-hackathon.challengepost.com/?ref_content=default&ref_feature=challenge&ref_medium=discover,Sense360's iOS Sensor Hackathon,challengepost3.assetspost.com/assets/defaults/thumbnail-placeholder-42bcab8d8178b413922ae2877d8b0868.gif,"Los Angeles, CA, US",Los Angeles,CA,"Jun 20 – 21, 2015",53,US,"What could your app do with Ambient Intelligence? Come be the very first to hack on the unreleased Sense360 iOS SDK...oh, and we have cool prizes...and lots of food :)"
http://app4mi.challengepost.com/?ref_content=default&ref_feature=challenge&ref_medium=discover,App4Mi,challengepost-s3-challengepost.netdna-ssl.com/photos/production/challenge_thumbnails/000/073/958/datas/medium.gif,Online,,,,0,,Hai una buona idea per utilizzare gli open data del Comune di Milano ? Realizzala con App4MI OPEN CONTEST e vinci! … non perderti inoltre gli appuntamenti formativi dell’ App4MI OPEN CAMPUS
http://kii.challengepost.com/?ref_content=default&ref_feature=challenge&ref_medium=discover,Kii Cloud App Challenge,challengepost-s3-challengepost.netdna-ssl.com/photos/production/challenge_thumbnails/000/073/959/datas/medium.jpg,Online,,,,0,,Unleash the power of your app with Kii Cloud's mobile backend services.
http://homeinonepiece.challengepost.com/?ref_content=default&ref_feature=challenge&ref_medium=discover,Home in One Piece,challengepost-s3-challengepost.netdna-ssl.com/photos/production/challenge_thumbnails/000/073/963/datas/medium.gif,Online,,,,0,,Design a way of helping motorists to become safer road users.
http://2013mtaappquest.challengepost.com/?ref_content=default&ref_feature=challenge&ref_medium=discover,MTA App Quest,challengepost-s3-challengepost.netdna-ssl.com/photos/production/challenge_thumbnails/000/073/966/datas/medium.jpg,Online,,,,0,,See how developers changed the way 8.5 million people commute every day.
http://cmusv-hackathon.challengepost.com/?ref_content=default&ref_feature=challenge&ref_medium=discover,CMU-SV HTML5 Hackathon April 12 - 13,challengepost-s3-challengepost.netdna-ssl.com/photos/production/challenge_thumbnails/000/073/961/datas/medium.jpg,"Mountain View, California, United States",Mountain View,California,"Apr 12 – 13, 2013",27,United States,"Organized by CMU-SV for attendees (technical & non-technical) to learn more about HTML5 single-page web apps, build HTML5 single-page apps, get fed, and compete for great prizes."
http://ford.challengepost.com/?ref_content=default&ref_feature=challenge&ref_medium=discover,Ford Personalized Fuel-Efficiency App Challenge,challengepost-s3-challengepost.netdna-ssl.com/photos/production/challenge_thumbnails/000/073/956/datas/medium.gif,Online,,,,0,,Ford challenged developers to help customers optimize their “personal” fuel-economy performance using the OpenXC platform.
http://appjam.challengepost.com/?ref_content=default&ref_feature=challenge&ref_medium=discover,Viggle App Jam,challengepost-s3-challengepost.netdna-ssl.com/photos/production/challenge_thumbnails/000/073/972/datas/medium.jpg,Online,,,,0,,See the second screen experience defined – check out the TV companion apps created with Viggle.
http://appsforworkinggov.challengepost.com/?ref_content=default&ref_feature=challenge&ref_medium=discover,Apps for Working Government,challengepost-s3-challengepost.netdna-ssl.com/photos/production/challenge_thumbnails/000/073/952/datas/medium.gif,Online,,,,0,,Get government working. Enter apps to educate people about partisan gridlock and help empower them to do something about it.
http://atlhoopshack.challengepost.com/?ref_content=default&ref_feature=challenge&ref_medium=discover,Atlanta Hoops Hackathon,challengepost-s3-challengepost.netdna-ssl.com/photos/production/challenge_thumbnails/000/073/951/datas/medium.png,"Atlanta, Georgia, United States",Atlanta,Georgia,"Mar 15 – 16, 2013",26,United States,Want to hack the 2013 Men’s Final Four in Atlanta to make it the best one yet? This will be the first hackathon in Atlanta to integrate digital and mobile media with rapid prototype manufacturing.
http://lhrhacks.challengepost.com/?ref_content=default&ref_feature=challenge&ref_medium=discover,Lahore Civic Hackathon,challengepost-s3-challengepost.netdna-ssl.com/photos/production/challenge_thumbnails/000/074/115/datas/medium.png,"Lahore, Punjab, PK",Lahore,Punjab,"Jan 24 – 26, 2014",36,PK,Calling all civic-minded geeks! Think your city could be better?
http://hacknroll2014.challengepost.com/?ref_content=default&ref_feature=challenge&ref_medium=discover,Hack&Roll 2014,challengepost-s3-challengepost.netdna-ssl.com/photos/production/challenge_thumbnails/000/074/122/datas/medium.png,,,,"Jan 25 – 26, 2014",36,,The largest student-run hackathon in Singapore
http://nyc-cryptocurrency.challengepost.com/?ref_content=default&ref_feature=challenge&ref_medium=discover,NYC Cryptocurrency Challenge 2014,challengepost-s3-challengepost.netdna-ssl.com/photos/production/challenge_thumbnails/000/074/123/datas/medium.jpg,"New York, NY, US",New York,NY,"Jan 17 – 20, 2014",36,US,"Build tools that expand accessibility, utility, or application of cyptocurrency or other digital currency technologies."
http://hackpoly.challengepost.com/?ref_content=default&ref_feature=challenge&ref_medium=discover,Hackpoly,challengepost-s3-challengepost.netdna-ssl.com/photos/production/challenge_thumbnails/000/074/119/datas/medium.png,"Pomona, CA, US",Pomona,CA,"Jan 24 – 25, 2014",36,US,"hackpoly ‘14 is the first Hackathon ever at Cal Poly Pomona. If you're a student in the inland empire, you should be at this hackathon."
http://idhack.challengepost.com/?ref_content=default&ref_feature=challenge&ref_medium=discover,ID Hack 2014,challengepost-s3-challengepost.netdna-ssl.com/photos/production/challenge_thumbnails/000/074/154/datas/medium.jpg,"Cambridge, MA, US",Cambridge,MA,"Feb 15 – 16, 2014",37,US,"I'D Hack for international development, wouldn't you?"
http://kentstatelaunchpad.challengepost.com/?ref_content=default&ref_feature=challenge&ref_medium=discover,Fashion/Tech Hackathon,challengepost-s3-challengepost.netdna-ssl.com/photos/production/challenge_thumbnails/000/074/113/datas/medium.jpg,"Kent, OH, US",Kent,OH,"Jan 31 – Feb 1, 2014",36,US,First collegiate fashion/tech hackathon!
http://hackout.challengepost.com/?ref_content=default&ref_feature=challenge&ref_medium=discover,HackOut,challengepost-s3-challengepost.netdna-ssl.com/photos/production/challenge_thumbnails/000/077/473/datas/medium.png,"Austin, Texas, United States",Austin,Texas,"Feb 15 – 16, 2014",37,United States,"HackOut is the first-ever, two-day, LGBT-oriented hackathon presented by StartOut."
http://html5fortizen.challengepost.com/?ref_content=default&ref_feature=challenge&ref_medium=discover,appbackr HTML5 to Tizen Challenge,challengepost-s3-challengepost.netdna-ssl.com/photos/production/challenge_thumbnails/000/074/109/datas/medium.png,Online,,,,0,,Get Your HTML5 app on Tizen Fast and With No Effort
http://ritios.challengepost.com/?ref_content=default&ref_feature=challenge&ref_medium=discover,RIT iOS App Challenge 2014,challengepost-s3-challengepost.netdna-ssl.com/photos/production/challenge_thumbnails/000/074/108/datas/medium.png,"Rochester, New York, United States",Rochester,New York,"Jan 29 – Feb 3, 2014",36,United States,Learn Objective-C and make an iOS App in less than a week then present it to the RIT community while competing for awesome prizes.
http://pebble.challengepost.com/?ref_content=default&ref_feature=challenge&ref_medium=discover,Pebble App Challenge,challengepost-s3-challengepost.netdna-ssl.com/photos/production/challenge_thumbnails/000/080/227/datas/medium.png,Online,,,,0,,A showdown of apps!
http://hackforpasadena.challengepost.com/?ref_content=default&ref_feature=challenge&ref_medium=discover,Hack for Pasadena,challengepost-s3-challengepost.netdna-ssl.com/photos/production/challenge_thumbnails/000/081/733/datas/medium.png,"Pasadena, CA, US",Pasadena,CA,"Mar 15 – 16, 2014",38,US,"Two-days of open-sourced talks and hands-on problem solving, to re-imagine the way the web, applications, technology, and community participation will shape the future of the City of Pasadena."
http://microsoftenterprisehack.challengepost.com/?ref_content=default&ref_feature=challenge&ref_medium=discover,The Microsoft Digital Enterprise Hack,challengepost-s3-challengepost.netdna-ssl.com/photos/production/challenge_thumbnails/000/080/752/datas/medium.png,"Washington, District of Columbia, United States",Washington,District of Columbia,"Mar 15 – 16, 2014",38,United States,"Join Booz Allen and 1776 for the Microsoft Digital Enterprise Hack, the first installment of the 1776 + Booz Allen Hack-celerator Series!"
http://phillybaseballhackday.challengepost.com/?ref_content=default&ref_feature=challenge&ref_medium=discover,Philly Baseball Hackday,challengepost-s3-challengepost.netdna-ssl.com/photos/production/challenge_thumbnails/000/080/693/datas/medium.png,"Philadelphia, PA, US",Philadelphia,PA,"Apr 6, 2014",39,US,"The first Philadelphia Baseball Hack Day is a fun, friendly one-day hacking competition for baseball fans."
http://hacksc2014.challengepost.com/?ref_content=default&ref_feature=challenge&ref_medium=discover,HackSC,challengepost-s3-challengepost.netdna-ssl.com/photos/production/challenge_thumbnails/000/080/208/datas/medium.png,"Los Angeles, CA, US",Los Angeles,CA,"Mar 7 – 9, 2014",38,US,"Build stuff, learn, hack, and innovate at USC during the weekend of March 7th 2014."
http://hacktothefuture.challengepost.com/?ref_content=default&ref_feature=challenge&ref_medium=discover,Hack to the Future: Reinventing the Way We Work,challengepost-s3-challengepost.netdna-ssl.com/photos/production/challenge_thumbnails/000/080/182/datas/medium.jpg,"Austin, TX, US",Austin,TX,"Mar 9, 2014",38,US,"Ideate an app that helps people work better together for the chance to win up to $10,000 in cash and the opportunity of a life time to pitch your idea to a venture capitalist!"
http://whack2014.challengepost.com/?ref_content=default&ref_feature=challenge&ref_medium=discover,Rosie @ Wellesley Hackathon,challengepost-s3-challengepost.netdna-ssl.com/photos/production/challenge_thumbnails/000/080/218/datas/medium.png,"Wellesley, MA, US",Wellesley,MA,"Mar 8 – 9, 2014",38,US,Collaborate for Change: Build Stuff. Have Fun.
http://texasamhackerbowl.challengepost.com/?ref_content=default&ref_feature=challenge&ref_medium=discover,Texas A&M HackerBowl,challengepost-s3-challengepost.netdna-ssl.com/photos/production/challenge_thumbnails/000/080/213/datas/medium.png,"College Station, TX, US",College Station,TX,"Mar 22 – 23, 2014",38,US,Hackers from across the state will battle for 24 hours to determine the best Hacker Team in Texas. Only one school can take home the Hacker Bowl Trophy. Will it be yours?
http://hackreginaspring2014.challengepost.com/?ref_content=default&ref_feature=challenge&ref_medium=discover,HackREGINA,challengepost-s3-challengepost.netdna-ssl.com/photos/production/challenge_thumbnails/000/080/041/datas/medium.jpg,"Regina, SK, CA",Regina,SK,"Mar 15, 2014",38,CA,"Duke it out with 50 other developers, designers, and analysts to make an application using one or more sponsored APIs. Teams present to a panel of judges for fame and prizes!"
http://flourish-hackathon.challengepost.com/?ref_content=default&ref_feature=challenge&ref_medium=discover,Flourish! 2014 Hackathon,challengepost-s3-challengepost.netdna-ssl.com/photos/production/challenge_thumbnails/000/094/163/datas/medium.png,"Chicago, IL, US",Chicago,IL,"Apr 5, 2014",39,US,Make an app or game related to nature in 7 hours and be eligible to win cool prizes. Help support the open source community!
http://disruptnyhackathon.challengepost.com/?ref_content=default&ref_feature=challenge&ref_medium=discover,TechCrunch Disrupt NY Hackathon,challengepost-s3-challengepost.netdna-ssl.com/photos/production/challenge_thumbnails/000/093/180/datas/medium.jpg,"New York, NY, US",New York,NY,"May 3 – 4, 2014",40,US,"Calling hackers, developers and designers— strut your stuff and win tickets to Disrupt NY"
http://springbreakgamejam.challengepost.com/?ref_content=default&ref_feature=challenge&ref_medium=discover,Spring Break Game Jam,challengepost-s3-challengepost.netdna-ssl.com/photos/production/challenge_thumbnails/000/093/131/datas/medium.jpg,"New York, NY, US",New York,NY,"Apr 12 – 13, 2014",39,US,"With the help of industry mentors, each team of NYC high school students will build a mobile web game that runs on the TreSensa Game Engine."
http://indycivichack.challengepost.com/?ref_content=default&ref_feature=challenge&ref_medium=discover,IndyCivicHack,challengepost2.assetspost.com/assets/defaults/thumbnail-placeholder-42bcab8d8178b413922ae2877d8b0868.gif,"Indianapolis, IN, US",Indianapolis,IN,"May 31, 2014",40,US,"We invite you to the first ever Indy Civic Hackathon May 31st in support of the National Day of Civic Hacking. We have a fun day of open data, networking, coding, giveaways and more planned."
http://revolutionuc.challengepost.com/?ref_content=default&ref_feature=challenge&ref_medium=discover,Revolution UC,challengepost-s3-challengepost.netdna-ssl.com/photos/production/challenge_thumbnails/000/093/227/datas/medium.png,"Cincinnati, OH, US",Cincinnati,OH,"Apr 5 – 6, 2014",39,US,Build Something Awesome
http://hackcwru2014.challengepost.com/?ref_content=default&ref_feature=challenge&ref_medium=discover,HackCWRU,challengepost-s3-challengepost.netdna-ssl.com/photos/production/challenge_thumbnails/000/082/134/datas/medium.png,"Cleveland, OH, US",Cleveland,OH,"Mar 28 – 29, 2014",38,US,HackCWRU - Connect. Learn. Build.
http://hack-waterloo.challengepost.com/?ref_content=default&ref_feature=challenge&ref_medium=discover,hackWaterloo,challengepost-s3-challengepost.netdna-ssl.com/photos/production/challenge_thumbnails/000/093/081/datas/medium.jpg,"Waterloo, ON, CA",Waterloo,ON,"Mar 29, 2014",38,CA,uWaterloo students hacking for the Waterloo community!
http://hackduke2014s.challengepost.com/?ref_content=default&ref_feature=challenge&ref_medium=discover,hackDuke Spring 2014: Code For Good,challengepost-s3-challengepost.netdna-ssl.com/photos/production/challenge_thumbnails/000/093/170/datas/medium.png,"Durham, North Carolina, United States",Durham,North Carolina,"Mar 29 – 30, 2014",38,United States,Be a superhero!
http://videoxhackathon.challengepost.com/?ref_content=default&ref_feature=challenge&ref_medium=discover,The Video Experience Hackathon at Kaltura Connect 2014,challengepost-s3-challengepost.netdna-ssl.com/photos/production/challenge_thumbnails/000/092/535/datas/medium.png,"New York, New York, United States",New York,New York,"Jun 13 – 15, 2014",41,United States,"Bring on your App dev and design skills, build a video application, present it to 1,200 attendees and win $50,000 prize!"
http://codingforcommunity.challengepost.com/?ref_content=default&ref_feature=challenge&ref_medium=discover,Coding for Community - A Civic Hackathon,challengepost3.assetspost.com/assets/defaults/thumbnail-placeholder-42bcab8d8178b413922ae2877d8b0868.gif,"Towson, MD, US",Towson,MD,"Apr 11 – 13, 2014",39,US,Building opportunities to help our neighborhoods survive and thrive.
http://lahacks.challengepost.com/?ref_content=default&ref_feature=challenge&ref_medium=discover,LA Hacks - Spring 2014,challengepost-s3-challengepost.netdna-ssl.com/photos/production/challenge_thumbnails/000/120/425/datas/medium.png,"Los Angeles, CA, US",Los Angeles,CA,"Apr 11 – 13, 2014",39,US,The Hackathon of the West Coast. 36 Hours. April 11-13 in Pauley Pavilion at UCLA.
http://mobileweeknyc.challengepost.com/?ref_content=default&ref_feature=challenge&ref_medium=discover,MobileWeek NYC Hackathon,challengepost3.assetspost.com/assets/defaults/thumbnail-placeholder-42bcab8d8178b413922ae2877d8b0868.gif,"New York, NY, US",New York,NY,"Apr 12 – 13, 2014",39,US,The MobileWeek Hackathon is a 30-hour app-building contest in downtown New York City - and is also the official kick-off of MobileWeek 2014!
http://hackillinois2014s.challengepost.com/?ref_content=default&ref_feature=challenge&ref_medium=discover,HackIllinois,challengepost-s3-challengepost.netdna-ssl.com/photos/production/challenge_thumbnails/000/120/483/datas/medium.png,,,,"Apr 11 – 19, 2014",39,,Imagine. Learn. Launch
http://hackuva.challengepost.com/?ref_content=default&ref_feature=challenge&ref_medium=discover,hack.UVA,challengepost-s3-challengepost.netdna-ssl.com/photos/production/challenge_thumbnails/000/120/336/datas/medium.jpeg,"Charlottesville, Virginia, United States",Charlottesville,Virginia,"Apr 11 – 13, 2014",39,United States,Virginia's Largest Hackathon Yet! One HACK UVA good time!
http://hackidc-2014.challengepost.com/?ref_content=default&ref_feature=challenge&ref_medium=discover,HackIDC,challengepost-s3-challengepost.netdna-ssl.com/photos/production/challenge_thumbnails/000/120/332/datas/medium.png,,,,"Apr 16 – 18, 2014",39,,HackIDC - IDC's first student Hackathon
http://lvhack14.challengepost.com/?ref_content=default&ref_feature=challenge&ref_medium=discover,LVHack 2014,challengepost-s3-challengepost.netdna-ssl.com/photos/production/challenge_thumbnails/000/119/352/datas/medium.png,"Bethlehem, PA, US",Bethlehem,PA,"Apr 11 – 13, 2014",39,US,"One amazing weekend to build exciting, interesting, and innovative things."
http://bitcamp.challengepost.com/?ref_content=default&ref_feature=challenge&ref_medium=discover,Bitcamp 2014,challengepost-s3-challengepost.netdna-ssl.com/photos/production/challenge_thumbnails/000/093/124/datas/medium.png,"College Park, MD, US",College Park,MD,"Apr 4 – 6, 2014",39,US,A new hackathon experience at University of Maryland.
http://dfw-weather.challengepost.com/?ref_content=default&ref_feature=challenge&ref_medium=discover,Inclement Weather & Emergency Hackathon,challengepost-s3-challengepost.netdna-ssl.com/photos/production/challenge_thumbnails/000/094/168/datas/medium.png,"Dallas, TX, US",Dallas,TX,"May 2 – 4, 2014",40,US,Dallas Makerspace's Civic Hacking Committee wants to help you create applications that will be *actually* useful in the event of a major telephone or power outage!
http://hacktsu.challengepost.com/?ref_content=default&ref_feature=challenge&ref_medium=discover,hackTSU,challengepost-s3-challengepost.netdna-ssl.com/photos/production/challenge_thumbnails/000/267/924/datas/medium.png,"Tbilisi, Tbilisi, GE",Tbilisi,Tbilisi,"Jun 18 – 21, 2015",53,GE,hackTSU
http://foundersfutureofwork.challengepost.com/?ref_content=default&ref_feature=challenge&ref_medium=discover,Founders Hackathon - Hacking “work”,challengepost-s3-challengepost.netdna-ssl.com/photos/production/challenge_thumbnails/000/266/932/datas/medium.png,,,,"Aug 8 – 9, 2015",55,,Hacking “work”
http://hackdc2015.challengepost.com/?ref_content=default&ref_feature=challenge&ref_medium=discover,HackDC 2015,challengepost-s3-challengepost.netdna-ssl.com/photos/production/challenge_thumbnails/000/264/509/datas/medium.png,"Annandale, VA, US",Annandale,VA,"Sep 25 – 27, 2015",56,US,Hacking Health: Create a mobile app for post-traumatic stress disorder (PTSD)
http://hackgenyisrael.challengepost.com/?ref_content=default&ref_feature=challenge&ref_medium=discover,Hacking Generation Y Israel,challengepost-s3-challengepost.netdna-ssl.com/photos/production/challenge_thumbnails/000/264/761/datas/medium.png,,,,"Jun 12 – 13, 2015",53,,"A 36-hour coding competition, bringing together some 450 of the brightest young developers across Israel!"
http://2015summergamejam.challengepost.com/?ref_content=default&ref_feature=challenge&ref_medium=discover,2015 Summer Game Jam,challengepost-s3-challengepost.netdna-ssl.com/photos/production/challenge_thumbnails/000/267/263/datas/medium.jpg,,,,"Jun 26 – 28, 2015",53,,"Emotional health and wellness video games for adolescents presented by Jennifer Ann's Group, a nonprofit charity preventing teen dating violence."
http://gamejam10beirut.challengepost.com/?ref_content=default&ref_feature=challenge&ref_medium=discover,Game Jam 10,challengepost-s3-challengepost.netdna-ssl.com/photos/production/challenge_thumbnails/000/261/540/datas/medium.jpg,"Minet El Hosn, Beirut, LB",Minet El Hosn,Beirut,"Jun 12 – 13, 2015",53,LB,Come hack with us at the free Microsoft Imagine Windows 10 Game Jam!
http://incubuslondon.challengepost.com/?ref_content=default&ref_feature=challenge&ref_medium=discover,IncuBus Hackathon at Interop,challengepost-s3-challengepost.netdna-ssl.com/photos/production/challenge_thumbnails/000/267/120/datas/medium.png,,,,"Jun 16 – 18, 2015",53,,Join the Fintech revolution at a hackathon sponsored by online payments provider Checkout.com.
http://operaparallelehackathon.challengepost.com/?ref_content=default&ref_feature=challenge&ref_medium=discover,Opera Parallèle Hackathon,challengepost1.assetspost.com/assets/defaults/thumbnail-placeholder-42bcab8d8178b413922ae2877d8b0868.gif,"San Francisco, CA, US",San Francisco,CA,"Jun 12 – 13, 2015",53,US,"We invite you to help us create an original, immersive theatrical experience for Opera Parallèle. Bring your cross-disciplinary talents to shape the future of the performing arts in San Francisco!"
http://apps4kids-hackathon.challengepost.com/?ref_content=default&ref_feature=challenge&ref_medium=discover,Apps4Kids Hackathon,challengepost-s3-challengepost.netdna-ssl.com/photos/production/challenge_thumbnails/000/265/578/datas/medium.png,"Vancouver, BC, CA",Vancouver,BC,"Jun 10 – 19, 2015",53,CA,Collaborating to solve medical challenges for children and youth with chronic care needs.
http://hackprincetons2014.challengepost.com/?ref_content=default&ref_feature=challenge&ref_medium=discover,HackPrinceton Spring 2014,challengepost-s3-challengepost.netdna-ssl.com/photos/production/challenge_thumbnails/000/078/998/datas/medium.jpg,"Princeton, New Jersey, United States",Princeton,New Jersey,"Mar 28 – 30, 2014",38,United States,The premier hardware and software hackathon. Realize your potential.
http://erwlandmineapps.challengepost.com/?ref_content=default&ref_feature=challenge&ref_medium=discover,Explosive Remnants of War and Land Mine Reporting Apps Challenge,challengepost2.assetspost.com/assets/defaults/thumbnail-placeholder-42bcab8d8178b413922ae2877d8b0868.gif,Online,,,,0,,Transform ordinary citizens' mobile devices into tools that can be used to report ERW and land mines
http://mashhacks-travel.challengepost.com/?ref_content=default&ref_feature=challenge&ref_medium=discover,MashHacks: Travel Presented by Emirates Airline,challengepost-s3-challengepost.netdna-ssl.com/photos/production/challenge_thumbnails/000/082/108/datas/medium.jpg,"Cambridge, MA, US",Cambridge,MA,"Mar 22, 2014",38,US,MashHacks: Travel Presented by Emirates Airline is a one-day hackathon focusing on innovation in the travel industry.
http://appcelerator.challengepost.com/?ref_content=default&ref_feature=challenge&ref_medium=discover,Appcelerator Enterprise App Challenge,challengepost-s3-challengepost.netdna-ssl.com/photos/production/challenge_thumbnails/000/079/005/datas/medium.png,Online,,,,0,,Show off your B2B or B2E app for a chance to win!
http://extremereality2014.challengepost.com/?ref_content=default&ref_feature=challenge&ref_medium=discover,Extreme Android Challenge 2014,challengepost-s3-challengepost.netdna-ssl.com/photos/production/challenge_thumbnails/000/079/988/datas/medium.png,Online,,,,0,,Extreme Android Challenge 2014
http://siliconimage.challengepost.com/?ref_content=default&ref_feature=challenge&ref_medium=discover,Dual Screen App Challenge,challengepost-s3-challengepost.netdna-ssl.com/photos/production/challenge_thumbnails/000/080/226/datas/medium.png,Online,,,,0,,Think Outside the Phone!
http://hackingagainstslavery.challengepost.com/?ref_content=default&ref_feature=challenge&ref_medium=discover,Hacking Against Slavery,challengepost2.assetspost.com/assets/defaults/thumbnail-placeholder-42bcab8d8178b413922ae2877d8b0868.gif,"New York, NY, US",New York,NY,"Mar 29, 2014",38,US,During this event some prompts for tools to help fight slavery will be presented. Then we will go to work.
http://hackatmacs.challengepost.com/?ref_content=default&ref_feature=challenge&ref_medium=discover,hack@MACS,challengepost-s3-challengepost.netdna-ssl.com/photos/production/challenge_thumbnails/000/076/222/datas/medium.jpg,"Tbilisi, Tbilisi, GE",Tbilisi,Tbilisi,"Mar 13 – 16, 2014",38,GE,The Biggest College Hackathon in Europe
http://sxswmusichack2014.challengepost.com/?ref_content=default&ref_feature=challenge&ref_medium=discover,SXSW Music Hackathon Championship,challengepost-s3-challengepost.netdna-ssl.com/photos/production/challenge_thumbnails/000/081/049/datas/medium.jpg,"Austin, TX, US",Austin,TX,"Mar 12 – 13, 2014",38,US,SXSW's first ever official music hackathon featuring some of the best music hackers of all time.
